commit	experiment	dataset	ratio	comp_MBps	decomp_MBps	fail	status	description
2b565a3	gdc1:9	ress1500	1.382	25.0	206.8	0	keep	baseline gdc1 v1 (3-stream LZ + order-0 rANS)
2b565a3	gdc1:9	page16k-ress600	1.279	55.6	632.1	0	keep	baseline 16KB pages; freq table 512Bx3 overhead visible
2b565a3	zstd:9	ress1500	1.362	31.8	827.2	0	keep	reference
2b565a3	kraken:7	ress1500	1.500	5.1	933.8	0	keep	reference (no-asm build, speed understated)
B8	gdc1:9	page16k-ress600	1.320	51.4	224.0	0	keep	RLE freq table + entropy threshold 256: ratio +3.2% on 16KB pages; decomp slower (more small streams entropy-coded), to be fixed by B1/B3
B8	gdc1:9	ress1500	1.387	26.4	209.1	0	keep	whole-file ratio +0.4%
B3	gdc1:9	ress1500	1.387	28.7	225.4	0	keep	wild-copy match copy: decomp +8%
B1	gdc1:9	ress1500	1.386	30.6	353.2	0	keep	2-way interleaved rANS + packed slot table: decomp +57%
B1	gdc1:9	asset2k	1.274	33.8	496.6	0	keep	asset subset decomp 497MB/s
B4	gdc1:9	ress1500	1.388	28.9	339.5	0	keep	rep-offset: ratio +0.1%, offsets stream skewed for rANS
B4	gdc1:9	bytes2k	2.180	44.6	1269.7	0	keep	vs zstd@9 2.462/270MBps: faster but ratio behind on small tables
B4	gdc1:9	prefab2k	2.999	15.6	611.6	0	keep	vs zstd@9 3.138/791MBps
B5	gdc1:9	ress1500	1.373	10.6	278.2	0	revert	3B offsets + 2MB window: offset cost > window gain on ress, comp speed collapsed (asset2k 2MBps)
T1/B9	autoplane+gdc1:9	ress1500	1.387	18.8	303.0	0	keep	autoplane(64KB seg, zstd-1 probe, 6% margin): neutral on ress (textures not raw block data)
T1/B9	autoplane+gdc1:9	asset2k	1.678	18.3	379.0	0	keep	vs gdc1:9 1.581: +6.2%! assets contain plane-friendly numeric arrays
T1/B9	autoplane+zstd:9	asset2k	1.707	26.0	810.0	0	keep	transform also helps zstd +5.7% => transform layer is backend-agnostic win
T1/B9	autoplane+gdc1:9	anim2k	1.283	24.0	477.0	0	keep	anim neutral
T1b	autoplane+gdc1:9	asset2k	1.745	10.5	370.4	0	keep	autoplane candidates + {p2, delta8, plane4+delta, plane8+delta}: asset +4% more (total +10.4% vs raw gdc1)
B1b	gdc1:9	ress1500	1.386	27.0	345.6	0	keep	16-bit renorm: branch instead of loop; asset decomp +20%
B1c	gdc1:9	ress1500	1.388	29.0	401.6	0	keep	4-way interleaved rANS decode: ress decomp +16%
B7	gdc1:9	ress1500	1.402	27.9	400.3	0	keep	offset lo/hi byte split into separate entropy streams: ress +1.0%
B7	gdc1:9	page16k-ress600	1.326	58.6	478.2	0	keep	pages +0.4%
P1	gdc1:9	ress1500	1.406	26.5	380.9	0	keep	aggressive lazy (len2>len): ress +0.3%, asset +0.6%
B7b	gdc1:9	ress1500	1.409	29.0	396.3	0	keep	separate length-extension stream (5 streams total): +0.2~0.4% everywhere (repeat=3 timing showed no real decomp cost)
B2	gdc1:9	asset2k	1.611	30.5	447.5	0	keep	order-1 lits (16 ctx by prev>>4), gated at 3% stream win: asset +0.9%, ress unaffected (o1 never wins 3% there)
BUG	gdc1:9	asset2k	-	-	-	2	fixed	rANS u32 overflow at f=SCALE (single-symbol context) desynced decoder; found via real data, fixed w/ u64 xMax; fuzz+file test harness added (tests/rans_o1_test.cpp)
M2	gdc1:9	ress2k	1.441	19.4	315.0	0	milestone	vs zstd@9 1.394/785, kraken@7 1.534/982 (kraken no-asm). gdc1 ratio now +3.4% over zstd
M2	autoplane+gdc1:9	asset2k	1.759	10.0	399.1	0	milestone	vs zstd@9 1.615/949, kraken@7 1.958/807. transform+gdc1 +8.9% over zstd
M2	gdc1:9	prefab2k	3.034	15.2	747.3	0	milestone	vs zstd@9 3.138, kraken@7 3.357
M2	gdc1:9	bytes2k	2.202	59.2	1659.6	0	milestone	vs zstd@9 2.462 (small files: dictionaries needed, T6)
M2	gdc1:9	anim2k	1.286	23.8	651.1	0	milestone	vs zstd@9 1.294: parity
M2	gdc1:9	page16k-ress600	1.329	44.2	342.6	0	milestone	vs zstd@9 1.353/655, leviathan@5 1.432/676, kraken@7 1.417/1028. gap to leviathan -7.2%
B2b	gdc1:9	asset2k	1.612	30.4	441.3	0	revert	tokens-stream o1: +0.06%, not worth encode cost
B3b	gdc1:9	prefab2k	3.034	17.1	852.2	0	keep	dist<8 LZ4-style pattern expansion in wild-copy: prefab decomp +14%, ress +3%
e568e78	B8b gdc1:9	page16k-ress600	1.340	51.6	495.9	0	keep	static trained freq tables (5 stream kinds, 0x8000|id tag) + entropy threshold 256->64: page16k ratio +0.8%, decomp +45% (cached static slot tables skip per-page table build); prefab +2.7% bytes +3.4%
e568e78	B8b gdc1:9	ress1500	1.4097	27.1	420.6	0	keep	static tables neutral on big files (inline table amortized)
d3f181b	B6 gdc1:9	ress1500	1.4244	2.6	410.8	0	keep	price-model optimal parse lvl9: 2-pass (greedy d32 -> per-symbol prices -> DP), rep tracked along path, >=1024 matches accepted greedily (avoids O(n*len) in runs), DP depth 128 for files >256KB / full 512 below: ress +1.0%
d3f181b	B6 gdc1:9	asset2k	1.6196	4.0	463.6	0	keep	asset +0.4%; autoplane+gdc1:9 1.7784 (+1.0%) ~= kraken@7 raw-file level
d3f181b	B6 gdc1:9	page16k-ress600	1.3465	1.8	461.5	0	keep	page16k +0.5% (gap to zstd@9 now -0.5%, leviathan -6.0%); prefab 3.1261 (+0.35%); lvl9 comp 2-5 MB/s = archive tier, lvl8 keeps lazy 35 MB/s
d3f181b	B6-flat gdc1:9	asset2k	1.6130	2.9	494.5	0	superseded	flat-cost DP (no price model) ~= lazy: cost model quality is the whole point of optimal parsing
318622b	D1 gdc1:9	ress1500	1.4245	1.8	482.5	0	keep	decoder lit fast-path (litLen<15 -> fixed 16B wild copy, 64B end margin): ress decomp +17%, prefab +10% (770), page16k +6% (489)
4a57f17	T6 gdc1:8+dict64k	bytes2k	5.326	15.3	1017.6	0	keep	shared prefix dict (64KB head-sampled): bytes 2.28->5.33 (+134%); zstd@9+dict 6.06 (zstd dict entropy tables still ahead); prefab +3%, page16k +0.4% (texture pages don't match head-sample dict)
